{
  "schema_version": "1.0.0",
  "evidence_hash": "31b3e99a6d2675691622e01ab0a0eb7b892df222d527cd5a734d4f785dc3fbac",
  "content": {
    "evidence_id": "host-startup-baseline-20260713",
    "evidence_status": "UNVALIDATED_ENGINEERING_BASELINE",
    "stage": "validation",
    "enabled_environments": ["shadow", "testnet"],
    "enabled_authorities": ["BINANCE_PRODUCTION_FAPI", "BINANCE_PRODUCTION_FSTREAM", "BINANCE_TESTNET_FAPI", "BINANCE_TESTNET_FSTREAM"],
    "host_boot_id": "host-boot-00000001",
    "issued_at": "2026-07-13T00:00:00Z",
    "expires_at": "2026-07-13T00:05:00Z",
    "release_binding": {
      "host_control_release_manifest_hash": "1111111111111111111111111111111111111111111111111111111111111111",
      "rate_allocator_image_digest": "sha256:1212121212121212121212121212121212121212121212121212121212121212",
      "rate_allocator_compose_hash": "1313131313131313131313131313131313131313131313131313131313131313",
      "gateway_image_digest": "sha256:1414141414141414141414141414141414141414141414141414141414141414",
      "gateway_compose_hash": "1515151515151515151515151515151515151515151515151515151515151515",
      "gateway_config_hash": "1616161616161616161616161616161616161616161616161616161616161616"
    },
    "artifact_binding": {
      "verification_keyring_schema_hash": "5757575757575757575757575757575757575757575757575757575757575757",
      "host_config_trust_root_hash": "5858585858585858585858585858585858585858585858585858585858585858",
      "release_signing_trust_root_hash": "5959595959595959595959595959595959595959595959595959595959595959",
      "rate_budget_schema_hash": "1717171717171717171717171717171717171717171717171717171717171717",
      "rate_budget_content_hash": "1818181818181818181818181818181818181818181818181818181818181818",
      "endpoint_catalog_schema_hash": "1919191919191919191919191919191919191919191919191919191919191919",
      "endpoint_catalog_content_hash": "2020202020202020202020202020202020202020202020202020202020202020",
      "mandatory_inventory_schema_hash": "2121212121212121212121212121212121212121212121212121212121212121",
      "mandatory_inventory_content_hash": "2222222222222222222222222222222222222222222222222222222222222222",
      "connection_contract_schema_hash": "2323232323232323232323232323232323232323232323232323232323232323",
      "connection_contract_content_hash": "2424242424242424242424242424242424242424242424242424242424242424",
      "trust_bundle_schema_hash": "2525252525252525252525252525252525252525252525252525252525252525",
      "trust_bundle_content_hash": "2626262626262626262626262626262626262626262626262626262626262626",
      "network_egress_schema_hash": "2727272727272727272727272727272727272727272727272727272727272727",
      "network_egress_content_hash": "2828282828282828282828282828282828282828282828282828282828282828",
      "rate_uds_schema_hash": "2929292929292929292929292929292929292929292929292929292929292929",
      "gateway_request_schema_hash": "3030303030303030303030303030303030303030303030303030303030303030",
      "gateway_ipc_schema_hash": "3131313131313131313131313131313131313131313131313131313131313131",
      "startup_evidence_schema_hash": "3232323232323232323232323232323232323232323232323232323232323232"
    },
    "database_authority": {
      "database": "aiq_host_rate_control",
      "migration_head": "host-rate-migration-0001",
      "wal_recovery_point": "wal-lsn-0-00000001",
      "fencing_epoch": 1,
      "fencing_owner_instance_id": "rate-allocator-instance-0001",
      "read_write": true,
      "independent_business_database": true
    },
    "sockets": {
      "rate_allocator": { "path": "/run/ai-quant-rate/rate.sock", "inode": 1001, "mode": "0660", "owner_uid": 11006, "owner_gid": 11990, "peer_acl_hash": "3333333333333333333333333333333333333333333333333333333333333333", "so_peercred_enforced": true },
      "binance_gateway": { "path": "/run/ai-quant-egress/gateway.sock", "inode": 1002, "mode": "0660", "owner_uid": 11005, "owner_gid": 11991, "peer_acl_hash": "3434343434343434343434343434343434343434343434343434343434343434", "so_peercred_enforced": true }
    },
    "network_boundary": {
      "binance_gateway_instance_count": 1,
      "business_container_binance_route_count": 0,
      "gateway_is_only_binance_socket_creator": true,
      "gateway_has_api_secret": false,
      "gateway_has_capability_signing_key": false,
      "tcp_ipc_fallback_enabled": false,
      "effective_policy_hash": "3535353535353535353535353535353535353535353535353535353535353535"
    },
    "authority_observations": [
      { "endpoint_authority": "BINANCE_PRODUCTION_FAPI", "observed_at": "2026-07-13T00:00:02Z", "server_time_observation_id": "prod-server-time-observation-0001", "server_time_observation_hash": "3636363636363636363636363636363636363636363636363636363636363636", "exchange_rate_limit_observation_id": "prod-rate-limit-observation-0001", "exchange_rate_limit_observation_hash": "3737373737373737373737373737373737373737373737373737373737373737", "connection_profile_id": null, "connection_contract_hash": null },
      { "endpoint_authority": "BINANCE_PRODUCTION_FSTREAM", "observed_at": "2026-07-13T00:00:02Z", "server_time_observation_id": null, "server_time_observation_hash": null, "exchange_rate_limit_observation_id": null, "exchange_rate_limit_observation_hash": null, "connection_profile_id": "production-fstream-profile-20260713", "connection_contract_hash": "2424242424242424242424242424242424242424242424242424242424242424" },
      { "endpoint_authority": "BINANCE_TESTNET_FAPI", "observed_at": "2026-07-13T00:00:02Z", "server_time_observation_id": "testnet-server-time-observation-0001", "server_time_observation_hash": "5454545454545454545454545454545454545454545454545454545454545454", "exchange_rate_limit_observation_id": "testnet-rate-limit-observation-0001", "exchange_rate_limit_observation_hash": "5555555555555555555555555555555555555555555555555555555555555555", "connection_profile_id": null, "connection_contract_hash": null },
      { "endpoint_authority": "BINANCE_TESTNET_FSTREAM", "observed_at": "2026-07-13T00:00:02Z", "server_time_observation_id": null, "server_time_observation_hash": null, "exchange_rate_limit_observation_id": null, "exchange_rate_limit_observation_hash": null, "connection_profile_id": "testnet-fstream-probe-profile-20260713", "connection_contract_hash": "5656565656565656565656565656565656565656565656565656565656565656" }
    ],
    "nonce_permit_integrity": {
      "outstanding_reserved_permit_count": 0,
      "duplicate_capability_nonce_count": 0,
      "consumed_without_gateway_count": 0,
      "outcome_missing_past_deadline_count": 0,
      "integrity_query_hash": "3838383838383838383838383838383838383838383838383838383838383838"
    },
    "bootstrap_chain": {
      "reserve_request_hashes": ["3939393939393939393939393939393939393939393939393939393939393939", "4040404040404040404040404040404040404040404040404040404040404040"],
      "reserve_decision_hashes": ["4141414141414141414141414141414141414141414141414141414141414141", "4242424242424242424242424242424242424242424242424242424242424242"],
      "gateway_request_hashes": ["4343434343434343434343434343434343434343434343434343434343434343", "4444444444444444444444444444444444444444444444444444444444444444"],
      "consume_request_hashes": ["4545454545454545454545454545454545454545454545454545454545454545", "4646464646464646464646464646464646464646464646464646464646464646"],
      "consume_decision_hashes": ["4747474747474747474747474747474747474747474747474747474747474747", "4848484848484848484848484848484848484848484848484848484848484848"],
      "send_outcome_hashes": ["4949494949494949494949494949494949494949494949494949494949494949", "5050505050505050505050505050505050505050505050505050505050505050"],
      "observation_hashes": ["5151515151515151515151515151515151515151515151515151515151515151", "5252525252525252525252525252525252525252525252525252525252525252"]
    },
    "readiness": {
      "rate_allocator_ready": true,
      "gateway_ready": true,
      "catalog_runtime_signed": true,
      "artifacts_not_expired": true,
      "blocked_authority_count": 0,
      "result": "READY"
    }
  },
  "signature": null
}
